{
  "$schema": "http://json-schema.org/draft-07/schema#",
  "$id": "https://bossolutions.pro/schemas/blueprint-export/site.v1.schema.json",
  "title": "BOSS Blueprint export — site.json (schemaVersion 1)",
  "type": "object",
  "required": ["schemaVersion", "submission", "siteSettings", "pages", "assets"],
  "properties": {
    "schemaVersion": { "const": 1 },
    "submission": { "$ref": "#/definitions/submission" },
    "siteSettings": { "$ref": "#/definitions/siteSettings" },
    "pages": {
      "type": "array",
      "minItems": 1,
      "items": { "$ref": "#/definitions/page" }
    },
    "assets": {
      "type": "array",
      "items": { "$ref": "#/definitions/asset" }
    }
  },
  "definitions": {

    "submission": {
      "type": "object",
      "required": ["id", "submittedAt", "client", "appVersion"],
      "properties": {
        "id": {
          "type": "string",
          "pattern": "^[0-9a-f]{8}-[0-9a-f]{4}-4[0-9a-f]{3}-[89ab][0-9a-f]{3}-[0-9a-f]{12}$"
        },
        "submittedAt": { "type": "string", "format": "date-time" },
        "designCreatedAt": { "type": ["string", "null"], "format": "date-time" },
        "client": {
          "type": "object",
          "required": ["name", "email"],
          "properties": {
            "name": { "type": "string", "minLength": 1 },
            "email": { "type": "string", "format": "email" }
          }
        },
        "appVersion": { "type": "string", "minLength": 1 }
      }
    },

    "siteSettings": {
      "type": "object",
      "required": ["businessName"],
      "properties": {
        "businessName": { "type": "string", "minLength": 1 },
        "tagline": { "type": ["string", "null"] },
        "about": { "type": ["string", "null"] },
        "vibe": {
          "anyOf": [
            { "type": "string", "enum": ["modern", "classic", "playful", "bold", "warm"] },
            { "type": "null" }
          ]
        },
        "styleNotes": { "type": ["string", "null"] },
        "colors": {
          "type": "array",
          "maxItems": 3,
          "items": { "type": "string", "pattern": "^#[0-9a-fA-F]{6}$" }
        }
      }
    },

    "page": {
      "type": "object",
      "required": ["id", "name", "slug", "height", "screenshot", "blocks", "penStrokes"],
      "properties": {
        "id": { "type": "string", "pattern": "^pg_[a-z0-9]{4,16}$" },
        "name": { "type": "string", "minLength": 1 },
        "slug": { "type": "string", "pattern": "^[a-z0-9]+(?:-[a-z0-9]+)*$", "maxLength": 40 },
        "height": { "type": "integer", "minimum": 1600, "maximum": 8000, "multipleOf": 8 },
        "extraBottomPx": { "type": "integer", "minimum": 0, "maximum": 4000, "multipleOf": 8 },
        "screenshot": {
          "type": "string",
          "pattern": "^pages/[0-9]{2}-[a-z0-9]+(?:-[a-z0-9]+)*\\.png$"
        },
        "blocks": {
          "type": "array",
          "items": { "$ref": "#/definitions/block" }
        },
        "penStrokes": {
          "type": "array",
          "items": { "$ref": "#/definitions/penStroke" }
        },
        "penRegions": {
          "type": "array",
          "items": { "$ref": "#/definitions/penRegion" }
        }
      }
    },

    "frame": {
      "type": "object",
      "required": ["x", "y", "w", "h"],
      "properties": {
        "x": { "type": "number" },
        "y": { "type": "number" },
        "w": { "type": "number", "exclusiveMinimum": 0 },
        "h": { "type": "number", "exclusiveMinimum": 0 }
      }
    },

    "link": {
      "oneOf": [
        {
          "type": "object",
          "required": ["kind", "pageId"],
          "properties": {
            "kind": { "const": "page" },
            "pageId": { "type": "string", "pattern": "^pg_[a-z0-9]{4,16}$" }
          }
        },
        {
          "type": "object",
          "required": ["kind", "url"],
          "properties": {
            "kind": { "const": "external" },
            "url": { "type": "string", "pattern": "^https?://" }
          }
        },
        {
          "type": "object",
          "required": ["kind"],
          "properties": { "kind": { "const": "none" } }
        }
      ]
    },

    "block": {
      "type": "object",
      "required": ["id", "type", "frame", "z"],
      "properties": {
        "id": { "type": "string", "pattern": "^blk_[a-z0-9]{4,16}$" },
        "type": {
          "enum": ["section", "heading", "text", "imageSlot", "button", "navBar"]
        },
        "frame": { "$ref": "#/definitions/frame" },
        "z": { "type": "integer", "minimum": 0 },
        "fromTemplate": { "type": "boolean" }
      },
      "oneOf": [
        { "$ref": "#/definitions/sectionBlock" },
        { "$ref": "#/definitions/headingBlock" },
        { "$ref": "#/definitions/textBlock" },
        { "$ref": "#/definitions/imageSlotBlock" },
        { "$ref": "#/definitions/buttonBlock" },
        { "$ref": "#/definitions/navBarBlock" }
      ]
    },

    "sectionBlock": {
      "type": "object",
      "properties": {
        "type": { "const": "section" },
        "background": {
          "anyOf": [
            { "type": "string", "pattern": "^#[0-9a-fA-F]{6}$" },
            { "type": "null" }
          ]
        }
      },
      "required": ["type"]
    },

    "headingBlock": {
      "type": "object",
      "required": ["type", "copyMode", "text"],
      "properties": {
        "type": { "const": "heading" },
        "copyMode": { "enum": ["real", "generate"] },
        "text": { "type": "string" },
        "generateDescription": { "type": ["string", "null"] },
        "lengthHint": { "type": ["string", "null"] }
      },
      "if": {
        "required": ["copyMode"],
        "properties": { "copyMode": { "const": "generate" } }
      },
      "then": {
        "required": ["generateDescription"],
        "properties": { "generateDescription": { "type": "string", "minLength": 1 } }
      }
    },

    "textBlock": {
      "type": "object",
      "required": ["type", "copyMode", "text"],
      "properties": {
        "type": { "const": "text" },
        "copyMode": { "enum": ["real", "generate"] },
        "text": { "type": "string" },
        "generateDescription": { "type": ["string", "null"] },
        "lengthHint": { "type": ["string", "null"] }
      },
      "if": {
        "required": ["copyMode"],
        "properties": { "copyMode": { "const": "generate" } }
      },
      "then": {
        "required": ["generateDescription"],
        "properties": { "generateDescription": { "type": "string", "minLength": 1 } }
      }
    },

    "imageSlotBlock": {
      "type": "object",
      "required": ["type", "assetId", "fit"],
      "properties": {
        "type": { "const": "imageSlot" },
        "assetId": {
          "anyOf": [
            { "type": "string", "pattern": "^img_[0-9]{3}$" },
            { "type": "null" }
          ]
        },
        "fit": { "enum": ["cover", "contain"] },
        "description": { "type": ["string", "null"] }
      }
    },

    "buttonBlock": {
      "type": "object",
      "required": ["type", "label", "link"],
      "properties": {
        "type": { "const": "button" },
        "label": { "type": "string", "minLength": 1 },
        "link": { "$ref": "#/definitions/link" }
      }
    },

    "navBarBlock": {
      "type": "object",
      "required": ["type", "items"],
      "properties": {
        "type": { "const": "navBar" },
        "items": {
          "type": "array",
          "minItems": 1,
          "maxItems": 10,
          "items": {
            "type": "object",
            "required": ["id", "label", "link"],
            "properties": {
              "id": { "type": "string", "pattern": "^nav_[a-z0-9]{4,16}$" },
              "label": { "type": "string", "minLength": 1 },
              "link": { "$ref": "#/definitions/link" }
            }
          }
        }
      }
    },

    "penStroke": {
      "type": "object",
      "required": ["id", "points", "color", "width", "role", "targetBlockId"],
      "properties": {
        "id": { "type": "string", "pattern": "^stk_[a-z0-9]{4,16}$" },
        "points": {
          "type": "array",
          "minItems": 2,
          "items": {
            "type": "array",
            "minItems": 2,
            "maxItems": 2,
            "items": { "type": "number" }
          }
        },
        "color": { "type": "string", "pattern": "^#[0-9a-fA-F]{6}$" },
        "width": { "type": "number", "exclusiveMinimum": 0 },
        "role": {
          "description": "Describes ink that NO penRegion claims. A stroke listed in some penRegions[].strokeIds on its page IS that region's content: read what it is from the region's kind (see 2.5, 2.9, 4.9.10) and treat role and targetBlockId as inert for it. Neither value ever means the drawn region is only a comment.",
          "enum": ["annotation", "imageSketch"]
        },
        "targetBlockId": {
          "anyOf": [
            { "type": "string", "pattern": "^blk_[a-z0-9]{4,16}$" },
            { "type": "null" }
          ]
        }
      },
      "if": {
        "required": ["role"],
        "properties": { "role": { "const": "imageSketch" } }
      },
      "then": {
        "properties": {
          "targetBlockId": { "type": "string", "pattern": "^blk_[a-z0-9]{4,16}$" }
        }
      }
    },

    "bbox": {
      "type": "object",
      "required": ["x", "y", "w", "h"],
      "properties": {
        "x": { "type": "number" },
        "y": { "type": "number" },
        "w": { "type": "number", "minimum": 0 },
        "h": { "type": "number", "minimum": 0 }
      }
    },

    "penRegion": {
      "type": "object",
      "required": [
        "id",
        "kind",
        "confidence",
        "bbox",
        "strokeIds",
        "parentRegionId",
        "setId",
        "setIndex",
        "text"
      ],
      "properties": {
        "id": { "type": "string", "pattern": "^reg_[a-z0-9]{4,16}$" },
        "kind": {
          "enum": ["panel", "writing", "navRow", "rule", "textPlaceholder", "artwork"]
        },
        "variant": { "type": "string" },
        "confidence": { "enum": ["clear", "unsure"] },
        "bbox": { "$ref": "#/definitions/bbox" },
        "strokeIds": {
          "type": "array",
          "minItems": 1,
          "items": { "type": "string", "pattern": "^stk_[a-z0-9]{4,16}$" }
        },
        "parentRegionId": {
          "anyOf": [
            { "type": "string", "pattern": "^reg_[a-z0-9]{4,16}$" },
            { "type": "null" }
          ]
        },
        "setId": {
          "anyOf": [
            { "type": "string", "pattern": "^set_[a-z0-9]{4,16}$" },
            { "type": "null" }
          ]
        },
        "setIndex": {
          "anyOf": [
            { "type": "integer", "minimum": 0 },
            { "type": "null" }
          ]
        },
        "text": {
          "anyOf": [
            { "type": "null" },
            {
              "type": "object",
              "required": ["lines", "words", "glyphHeight", "align", "emphasis"],
              "properties": {
                "lines": { "type": "integer", "minimum": 1 },
                "words": { "type": "integer", "minimum": 1 },
                "glyphHeight": { "type": "number", "minimum": 0 },
                "align": { "enum": ["left", "center", "right"] },
                "emphasis": { "enum": ["display", "heading", "body"] }
              }
            }
          ]
        }
      }
    },

    "asset": {
      "type": "object",
      "required": ["id", "path", "originalFilename", "mimeType", "width", "height", "bytes"],
      "properties": {
        "id": { "type": "string", "pattern": "^img_[0-9]{3}$" },
        "path": {
          "type": "string",
          "pattern": "^assets/img_[0-9]{3}\\.(jpg|png|webp)$"
        },
        "originalFilename": { "type": "string", "minLength": 1 },
        "mimeType": { "enum": ["image/jpeg", "image/png", "image/webp"] },
        "width": { "type": "integer", "minimum": 1 },
        "height": { "type": "integer", "minimum": 1 },
        "bytes": { "type": "integer", "minimum": 1 }
      }
    }
  }
}
